{"$schema":"https://json-schema.org/draft/2020-12/schema","$id":"https://leaduxai.id/schemas/content-strategist/performance-observation.schema.json","title":"LeadUX Content Performance Observation","type":"object","required":["observation_id","content_id","platform","published_at","observed_at","metrics"],"properties":{"observation_id":{"type":"string"},"content_id":{"type":"string"},"brief_id":{"type":["string","null"]},"platform":{"type":"string"},"account":{"type":["string","null"]},"published_at":{"type":"string"},"observed_at":{"type":"string"},"metrics":{"type":"object","additionalProperties":{"type":["number","integer","null"]}},"missing_metrics":{"type":"array","items":{"type":"string"}},"baseline":{"type":["object","null"],"additionalProperties":true},"known_confounders":{"type":"array","items":{"type":"string"}}},"additionalProperties":true}
